{
  "slug": "demo-sig-lite",
  "source_filename": "SIG-Lite-Demo.csv",
  "imported_at": "2025-06-01T00:00:00.000Z",
  "questions": [
    { "qid": "A.1", "section": "Access Control", "text": "Does your organization implement role-based access control (RBAC)?", "answer_type": "yes_no" },
    { "qid": "A.2", "section": "Access Control", "text": "Is multi-factor authentication (MFA) required for all privileged accounts?", "answer_type": "yes_no" },
    { "qid": "A.3", "section": "Access Control", "text": "Do you perform periodic access reviews?", "answer_type": "yes_no" },
    { "qid": "A.4", "section": "Access Control", "text": "Describe your process for revoking access when an employee leaves.", "answer_type": "text" },
    { "qid": "B.1", "section": "Cryptography", "text": "Is data at rest encrypted? Describe the algorithm used.", "answer_type": "text" },
    { "qid": "B.2", "section": "Cryptography", "text": "Is data in transit encrypted using TLS 1.2 or higher?", "answer_type": "yes_no" },
    { "qid": "B.3", "section": "Cryptography", "text": "Do you have a formal key management policy?", "answer_type": "yes_no" },
    { "qid": "C.1", "section": "Incident Management", "text": "Do you have a documented Incident Response Plan (IRP)?", "answer_type": "yes_no" },
    { "qid": "C.2", "section": "Incident Management", "text": "How quickly do you notify customers of a confirmed data breach?", "answer_type": "text" },
    { "qid": "C.3", "section": "Incident Management", "text": "Is your IRP tested at least annually?", "answer_type": "yes_no" },
    { "qid": "D.1", "section": "Vulnerability Management", "text": "Do you conduct regular vulnerability scanning?", "answer_type": "yes_no" },
    { "qid": "D.2", "section": "Vulnerability Management", "text": "Do you perform penetration testing at least annually?", "answer_type": "yes_no" },
    { "qid": "D.3", "section": "Vulnerability Management", "text": "What is your SLA for patching Critical vulnerabilities?", "answer_type": "text" },
    { "qid": "E.1", "section": "Data Management", "text": "Do you have a data classification policy?", "answer_type": "yes_no" },
    { "qid": "E.2", "section": "Data Management", "text": "Describe your data retention and deletion policies.", "answer_type": "text" },
    { "qid": "E.3", "section": "Data Management", "text": "Are customer data backups encrypted?", "answer_type": "yes_no" },
    { "qid": "F.1", "section": "Operational Security", "text": "Do you log and monitor access to systems containing customer data?", "answer_type": "yes_no" },
    { "qid": "F.2", "section": "Operational Security", "text": "Do you have a formal change management process?", "answer_type": "yes_no" },
    { "qid": "G.1", "section": "Human Resources Security", "text": "Do employees receive security awareness training?", "answer_type": "yes_no" },
    { "qid": "G.2", "section": "Human Resources Security", "text": "Are background checks performed on employees with access to sensitive systems?", "answer_type": "yes_no_na" },
    { "qid": "H.1", "section": "Physical Security", "text": "Are your data centers certified to SOC 2 or ISO 27001?", "answer_type": "yes_no" },
    { "qid": "H.2", "section": "Physical Security", "text": "Is physical access to servers restricted to authorised personnel only?", "answer_type": "yes_no" },
    { "qid": "I.1", "section": "Compliance", "text": "Does your organization hold a current SOC 2 Type II report?", "answer_type": "yes_no" },
    { "qid": "I.2", "section": "Compliance", "text": "Is your organization certified to ISO 27001?", "answer_type": "yes_no_na" },
    { "qid": "I.3", "section": "Compliance", "text": "Are you GDPR compliant for handling EU personal data?", "answer_type": "yes_no" },
    { "qid": "J.1", "section": "Third-Party Risk", "text": "Do you conduct security assessments of critical sub-processors?", "answer_type": "yes_no" },
    { "qid": "J.2", "section": "Third-Party Risk", "text": "Do you maintain a list of sub-processors accessible to customers?", "answer_type": "yes_no" },
    { "qid": "K.1", "section": "Business Continuity", "text": "Do you have a Business Continuity Plan (BCP)?", "answer_type": "yes_no" },
    { "qid": "K.2", "section": "Business Continuity", "text": "What are your RTO and RPO commitments?", "answer_type": "text" },
    { "qid": "K.3", "section": "Business Continuity", "text": "Is your BCP tested at least annually?", "answer_type": "yes_no" }
  ]
}
